{
  "$schema": "https://json-schema.org/draft/2020-12/schema",
  "$id": "https://raw.githubusercontent.com/Automattic/wp-gym/main/schemas/trace.v1.schema.json",
  "title": "WP Gym Trace v1",
  "description": "Canonical replay trace for a wp-gym episode. See https://github.com/Automattic/wp-gym/issues/80.",
  "type": "object",
  "required": ["schema_version", "episode_id", "scenario_id", "metadata", "steps"],
  "properties": {
    "schema_version": { "const": 1 },
    "episode_id": { "type": "string", "minLength": 1 },
    "scenario_id": { "type": "string", "minLength": 1 },
    "metadata": {
      "type": "object",
      "required": ["max_steps", "allowed_action_types", "setup", "success_checks"],
      "properties": {
        "max_steps": { "type": "integer", "minimum": 1 },
        "allowed_action_types": {
          "type": "array",
          "minItems": 1,
          "items": { "enum": ["wp_cli", "filesystem", "rest", "browser"] },
          "uniqueItems": true
        },
        "setup": {
          "type": "array",
          "items": { "type": "string", "minLength": 1 }
        },
        "success_checks": {
          "type": "array",
          "items": { "type": "string", "pattern": "^[a-z0-9_]+$" },
          "uniqueItems": true
        }
      },
      "additionalProperties": true
    },
    "steps": {
      "type": "array",
      "items": {
        "type": "object",
        "required": ["step_index", "timestamp", "action", "result"],
        "properties": {
          "step_index": { "type": "integer", "minimum": 0 },
          "timestamp": { "type": "string", "format": "date-time" },
          "action": { "$ref": "https://raw.githubusercontent.com/Automattic/wp-gym/main/schemas/action.v1.schema.json" },
          "result": { "$ref": "https://raw.githubusercontent.com/Automattic/wp-gym/main/schemas/step-result.v1.schema.json" }
        },
        "additionalProperties": false
      }
    }
  },
  "additionalProperties": false
}
